,disease,link,overview,symptoms,remedies
234,Residual limb pain,https://www.mayoclinic.org/diseases-conditions/residual-limb-pain/cdc-20447167,,[],"['Look for distractions. Find activities that take your focus off the pain, such as reading or listening to music.', 'Stay physically active. Get your exercise by doing activities that you enjoy, such as gardening, walking, swimming or cycling.', ""Take your medications. Follow your doctor's directions in taking prescribed and over-the-counter pain medications. If you try herbal and other alternative medications, be sure to tell your doctor."", 'Find ways to relax. Practice activities that reduce your emotional and muscular tension. Take a warm bath — not too hot, as heat may aggravate the pain. Lie down and follow helpful relaxation techniques, such as rhythmic breathing, meditation or visualization.', 'Seek support from other people. Find ways to get closer to others. Call friends, or join a support group or a group involved in your favorite hobby.']"
235,Respiratory syncytial virus (RSV),https://www.mayoclinic.org/diseases-conditions/respiratory-syncytial-virus/symptoms-causes/syc-20353098,Respiratory syncytial virus (RSV) causes infections of the lungs and respiratory tract. It's so common that most children have been infected with the virus by age 2. Respiratory syncytial (sin-SISH-ul) virus can also infect adults.,"['Congested or runny nose', 'Dry cough', 'Low-grade fever', 'Sore throat', 'Sneezing', 'Headache']","['Create moist air to breathe. Keep the room warm but not overheated. If the air is dry, a cool-mist humidifier or vaporizer can moisten the air and help ease congestion and coughing. Be sure to keep the humidifier clean to prevent the growth of bacteria and molds.', 'Drink fluids. Continue breastfeeding or bottle-feeding your infant as you would normally. For older children and adults, keep a steady supply of cool water at the bedside. Offer warm fluids, such as soup, which may help loosen thickened secretions. Ice pops may be soothing as well.', ""Try saline nasal drops. Over-the-counter (OTC) drops are a safe, effective way to ease congestion, even for young children. Follow your doctor's recommendations and the instructions on the product."", ""Use over-the-counter pain relievers. OTC pain relievers such as acetaminophen (Tylenol, others) may help reduce fever and relieve a sore throat. Ask a doctor for the correct dose for your child's age."", 'Stay away from cigarette smoke. Secondhand smoke can aggravate symptoms.']"
236,Restless legs syndrome,https://www.mayoclinic.org/diseases-conditions/restless-legs-syndrome/symptoms-causes/syc-20377168,"Restless legs syndrome (RLS) is a condition that causes an uncontrollable urge to move the legs, usually because of an uncomfortable sensation. It typically happens in the evening or nighttime hours when you're sitting or lying down. Moving eases the unpleasant feeling temporarily.","[""Sensations that begin while resting. The sensation typically begins after you've been lying down or sitting for an extended time, such as in a car, airplane or movie theater."", 'Relief with movement. The sensation of RLS lessens with movement, such as stretching, jiggling the legs, pacing or walking.', 'Worsening of symptoms in the evening. Symptoms occur mainly at night.', 'Nighttime leg twitching. RLS may be associated with another, more common condition called periodic limb movement of sleep, which causes the legs to twitch and kick, possibly throughout the night, while you sleep.']","['Try baths and massages. Soaking in a warm bath and massaging the legs can relax the muscles.', 'Apply warm or cool packs. Use of heat or cold, or alternating use of the two, may lessen the limb sensations.', ""Establish good sleep hygiene. Fatigue tends to worsen symptoms of RLS, so it's important that you practice good sleep hygiene. Ideally, have a cool, quiet, comfortable sleeping environment; go to bed and rise at the same time daily; and get at least seven hours of sleep nightly."", 'Exercise. Getting moderate, regular exercise may relieve symptoms of RLS, but overdoing it or working out too late in the day may intensify symptoms.', 'Avoid caffeine. Sometimes cutting back on caffeine may help restless legs. Try to avoid caffeine-containing products, including chocolate, coffee, tea and soft drinks, for a few weeks to see if this helps.', 'Consider using a foot wrap or a vibrating pad. A foot wrap specially designed for people with RLS puts pressure under the foot and may help relieve your symptoms. You may also find relief using a pad that vibrates on the back of the legs.']"
237,Retinal detachment,https://www.mayoclinic.org/diseases-conditions/retinal-detachment/symptoms-causes/syc-20351344,Retinal detachment describes an emergency situation in which a thin layer of tissue (the retina) at the back of the eye pulls away from its normal position.,"['The sudden appearance of many floaters — tiny specks that seem to drift through your field of vision', 'Flashes of light in one or both eyes (photopsia)', 'Blurred vision', 'Gradually reduced side (peripheral) vision', 'A curtain-like shadow over your field of vision']",[]
238,Retinal diseases,https://www.mayoclinic.org/diseases-conditions/retinal-diseases/symptoms-causes/syc-20355825,"Retinal diseases vary widely, but most of them cause visual symptoms. Retinal diseases can affect any part of your retina, a thin layer of tissue on the inside back wall of your eye.","['Seeing floating specks or cobwebs', 'Blurred or distorted (straight lines look wavy) vision', 'Defects in the side vision', 'Lost vision']",[]
239,Retinoblastoma,https://www.mayoclinic.org/diseases-conditions/retinoblastoma/symptoms-causes/syc-20351008,"Retinoblastoma is an eye cancer that begins in the retina — the sensitive lining on the inside of your eye. Retinoblastoma most commonly affects young children, but can rarely occur in adults.","['A white color in the center circle of the eye (pupil) when light is shone in the eye, such as when someone takes a flash photograph of the child', 'Eyes that appear to be looking in different directions', 'Poor vision', 'Eye redness', 'Eye swelling']",[]
240,"Retinopathy, diabetic, also known as
Diabetic retinopathy",https://www.mayoclinic.org/diseases-conditions/diabetic-retinopathy/symptoms-causes/syc-20371611,Diabetic retinopathy (die-uh-BET-ik ret-ih-NOP-uh-thee) is a diabetes complication that affects eyes. It's caused by damage to the blood vessels of the light-sensitive tissue at the back of the eye (retina).,"['Spots or dark strings floating in your vision (floaters)', 'Blurred vision', 'Fluctuating vision', 'Dark or empty areas in your vision', 'Vision loss']",[]
241,Retractile testicle,https://www.mayoclinic.org/diseases-conditions/retractile-testicle/symptoms-causes/syc-20377197,"A retractile testicle is a testicle that may move back and forth between the scrotum and the groin. When the retractile testicle is residing in the groin, it might be easily guided by hand into its proper position in the scrotum — the bag of skin hanging behind the penis — during a physical exam. Upon release, the testicle will remain in the proper position at least temporarily.","[""The testicle may be moved by hand from the groin into the scrotum and won't immediately retreat to the groin."", 'The testicle might spontaneously appear in the scrotum and remain there for a time.', 'The testicle might spontaneously disappear again for a time.']",[]
242,Retrograde ejaculation,https://www.mayoclinic.org/diseases-conditions/retrograde-ejaculation/symptoms-causes/syc-20354890,"Retrograde ejaculation occurs when semen enters the bladder instead of emerging through the penis during orgasm. Although you still reach sexual climax, you might ejaculate very little or no semen. This is sometimes called a dry orgasm.","['Orgasms in which you ejaculate very little or no semen out of your penis (dry orgasms)', 'Urine that is cloudy after orgasm because it contains semen', 'Inability to get a woman pregnant (male infertility)']",[]
243,Rett syndrome,https://www.mayoclinic.org/diseases-conditions/rett-syndrome/symptoms-causes/syc-20377227,Rett syndrome is a rare genetic neurological and developmental disorder that affects the way the brain develops. This disorder causes a progressive loss of motor skills and language. Rett syndrome primarily affects females.,"['Slowed growth. Brain growth slows after birth. Smaller than usual head size (microcephaly) is sometimes the first sign that a child has Rett syndrome. As children get older, there is delayed growth in other parts of the body.', 'Loss of movement and coordination abilities. The first signs often include reduced hand control and a decreasing ability to crawl or walk. At first, this loss of abilities occurs rapidly, and then it continues more gradually. Eventually muscles become weak or stiff, with unusual movement and positioning.', 'Loss of communication abilities. Children with Rett syndrome typically begin to lose the ability to speak, to make eye contact and to communicate in other ways. They may become disinterested in other people, toys and their surroundings. Some children have rapid changes, such as a sudden loss of language. Over time, children may gradually regain eye contact and develop nonverbal communication skills.', 'Unusual hand movements. Children with Rett syndrome usually develop repetitive, purposeless hand movements, which differ from child to child. Hand movements may include hand-wringing, squeezing, clapping, tapping or rubbing.']",[]
244,Reye's syndrome,https://www.mayoclinic.org/diseases-conditions/reyes-syndrome/symptoms-causes/syc-20377255,"Reye's (Reye) syndrome is a rare but serious condition that causes swelling in the liver and brain. Reye's syndrome most often affects children and teenagers recovering from a viral infection, most commonly the flu or chickenpox.","['Diarrhea', 'Rapid breathing']",[]
245,Rhabdomyosarcoma,https://www.mayoclinic.org/diseases-conditions/rhabdomyosarcoma/symptoms-causes/syc-20390962,"Rhabdomyosarcoma (RMS) is a rare type of cancer that forms in soft tissue — specifically skeletal muscle tissue or sometimes hollow organs such as the bladder or uterus. RMS can occur at any age, but it most often affects children.","['Headache', 'Bulging or swelling of the eyes', 'Bleeding in the nose, throat or ears']",[]
246,Rheumatic fever,https://www.mayoclinic.org/diseases-conditions/rheumatic-fever/symptoms-causes/syc-20354588,Rheumatic fever is an inflammatory disease that can develop when strep throat or scarlet fever isn't properly treated. Strep throat and scarlet fever are caused by an infection with streptococcus (strep-toe-KOK-us) bacteria.,"['Fever', 'Painful and tender joints — most often in the knees, ankles, elbows and wrists', 'Pain in one joint that migrates to another joint', 'Red, hot or swollen joints', 'Chest pain', 'Fatigue', 'Flat or slightly raised, painless rash with a ragged edge', 'Heart murmur', 'Jerky, uncontrollable body movements (Sydenham chorea) — most often in the hands, feet and face', 'Outbursts of unusual behavior, such as crying or inappropriate laughing, that accompanies Sydenham chorea', 'Small, painless bumps beneath the skin']","[""Your child's symptoms, including any that seem unrelated to your reason for scheduling the appointment and any that have recently been resolved"", 'Recent illnesses your child has had', 'All medications, vitamins or other supplements your child takes or has recently taken, including doses', 'Questions to ask the care provider']"
247,Rheumatoid arthritis,https://www.mayoclinic.org/diseases-conditions/rheumatoid-arthritis/symptoms-causes/syc-20353648,"Rheumatoid arthritis is a chronic inflammatory disorder that can affect more than just your joints. In some people, the condition can damage a wide variety of body systems, including the skin, eyes, lungs, heart and blood vessels.","['Tender, warm, swollen joints', 'Joint stiffness that is usually worse in the mornings and after inactivity', 'Fatigue, fever and loss of appetite']","[""Exercise regularly. Gentle exercise can help strengthen the muscles around your joints, and it can help reduce fatigue you might feel. Check with your doctor before you start exercising. If you're just getting started, begin by taking a walk. Avoid exercising tender, injured or severely inflamed joints."", 'Apply heat or cold. Heat can help ease your pain and relax tense, painful muscles. Cold may dull the sensation of pain. Cold also has a numbing effect and can reduce swelling.', 'Relax. Find ways to cope with pain by reducing stress in your life. Techniques such as guided imagery, deep breathing and muscle relaxation can all be used to control pain.']"
248,"Rhinitis, allergic, also known as
Hay fever",https://www.mayoclinic.org/diseases-conditions/hay-fever/symptoms-causes/syc-20373039,"Hay fever, also called allergic rhinitis, causes cold-like symptoms. These may include a runny nose, itchy eyes, congestion, sneezing and sinus pressure. But unlike a cold, hay fever isn't caused by a virus. Hay fever is caused by an allergic response to a harmless outdoor or indoor substance the body identifies as harmful (allergen).","['Runny nose and nasal stuffiness (congestion)', 'Watery, itchy, red eyes (allergic conjunctivitis)', 'Sneezing', 'Cough', 'Itchy nose, roof of mouth or throat', 'Mucus that runs down the back of your throat (postnasal drip)', 'Swollen, bruised-appearing skin under the eyes (allergic shiners)', 'Extreme tiredness (fatigue), often due to poor sleep']","['Close doors and windows during pollen season.', ""Don't hang laundry outside — pollen can stick to sheets and towels."", 'Use air conditioning in your house and car.', 'Use an allergy-grade filter in your home ventilation system and change it regularly.', 'Avoid outdoor activity in the early morning, when pollen counts are highest, and also on high pollen-count days.', 'Stay indoors on dry, windy days.', 'Use a dehumidifier to reduce indoor humidity.', 'Use a high-efficiency particulate air (HEPA) filter in your bedroom and other rooms where you spend a lot of time.', 'Avoid mowing the lawn or raking leaves.', 'Wear a dust mask when cleaning house or gardening.', 'Wear glasses or sunglasses when outside to limit pollen getting in your eyes.']"
249,"Rhinitis, nonallergic, also known as
Nonallergic rhinitis",https://www.mayoclinic.org/diseases-conditions/nonallergic-rhinitis/symptoms-causes/syc-20351229,"Nonallergic rhinitis involves chronic sneezing or a congested, drippy nose with no apparent cause. Nonallergic rhinitis symptoms are similar to those of hay fever (allergic rhinitis), but with none of the usual evidence of an allergic reaction.","['Stuffy or runny nose', 'Sneezing', 'Mucus in the throat', 'Cough']","[""Rinse your nasal passages. Use a specially designed squeeze bottle — such as the one included in saline kits — a bulb syringe or a neti pot to irrigate your nasal passages. This home remedy, called nasal lavage, can help keep your nose free of irritants. When used daily, this is one of the most effective treatments for nonallergic rhinitis.\nTo prevent infection, use water that's distilled, sterile, previously boiled and cooled, or filtered using a filter with an absolute pore size of 1 micron or smaller to make up the irrigation solution. Also be sure to rinse the irrigation device after each use with similarly distilled, sterile, previously boiled and cooled, or filtered water and leave open to air-dry."", 'Blow your nose. Regularly and gently blow your nose if mucus or irritants are present.', ""Humidify. If the air in your home or office is dry, set up a humidifier in your work or sleep location. Be sure to regularly clean the humidifier according to the manufacturer's instructions. You can also breathe in the steam from a warm shower to help loosen the mucus in your nose and clear your head of stuffiness."", 'Drink liquids. Drinking plenty of liquids, including water, juice and caffeine-free tea, can help loosen the mucus in your nose. Avoid caffeinated beverages.']"
250,"Rhinitis, vasomotor, also known as
Nonallergic rhinitis",https://www.mayoclinic.org/diseases-conditions/nonallergic-rhinitis/symptoms-causes/syc-20351229,"Nonallergic rhinitis involves chronic sneezing or a congested, drippy nose with no apparent cause. Nonallergic rhinitis symptoms are similar to those of hay fever (allergic rhinitis), but with none of the usual evidence of an allergic reaction.","['Stuffy or runny nose', 'Sneezing', 'Mucus in the throat', 'Cough']","[""Rinse your nasal passages. Use a specially designed squeeze bottle — such as the one included in saline kits — a bulb syringe or a neti pot to irrigate your nasal passages. This home remedy, called nasal lavage, can help keep your nose free of irritants. When used daily, this is one of the most effective treatments for nonallergic rhinitis.\nTo prevent infection, use water that's distilled, sterile, previously boiled and cooled, or filtered using a filter with an absolute pore size of 1 micron or smaller to make up the irrigation solution. Also be sure to rinse the irrigation device after each use with similarly distilled, sterile, previously boiled and cooled, or filtered water and leave open to air-dry."", 'Blow your nose. Regularly and gently blow your nose if mucus or irritants are present.', ""Humidify. If the air in your home or office is dry, set up a humidifier in your work or sleep location. Be sure to regularly clean the humidifier according to the manufacturer's instructions. You can also breathe in the steam from a warm shower to help loosen the mucus in your nose and clear your head of stuffiness."", 'Drink liquids. Drinking plenty of liquids, including water, juice and caffeine-free tea, can help loosen the mucus in your nose. Avoid caffeinated beverages.']"
251,"Rib fracture, also known as
Broken ribs",https://www.mayoclinic.org/diseases-conditions/broken-ribs/symptoms-causes/syc-20350763,"A broken rib is a common injury that occurs when one of the bones in your rib cage breaks or cracks. The most common cause is chest trauma, such as from a fall, motor vehicle accident or impact during contact sports.","['Take a deep breath', 'Press on the injured area', 'Bend or twist your body']",[]
252,Rickets,https://www.mayoclinic.org/diseases-conditions/rickets/symptoms-causes/syc-20351943,"Rickets is the softening and weakening of bones in children, usually because of an extreme and prolonged vitamin D deficiency. Rare inherited problems also can cause rickets.","['Delayed growth', 'Delayed motor skills', 'Pain in the spine, pelvis and legs', 'Muscle weakness']",[]
253,"Rift Valley fever, also known as
Viral hemorrhagic fevers",https://www.mayoclinic.org/diseases-conditions/viral-hemorrhagic-fevers/symptoms-causes/syc-20351260,"Viral hemorrhagic (hem-uh-RAJ-ik) fevers are infectious diseases that can cause severe, life-threatening illness. They can damage the walls of tiny blood vessels, making them leak, and can hamper the blood's ability to clot. The resulting internal bleeding is usually not life-threatening, but the diseases can be.","['Fever', 'Fatigue, weakness or general feeling of being unwell', 'Dizziness', 'Muscle, bone or joint aches', 'Nausea and vomiting', 'Diarrhea']",[]
254,"Ringing in the ear, also known as
Tinnitus",https://www.mayoclinic.org/diseases-conditions/tinnitus/symptoms-causes/syc-20350156,"Tinnitus is when you experience ringing or other noises in one or both of your ears. The noise you hear when you have tinnitus isn't caused by an external sound, and other people usually can't hear it. Tinnitus is a common problem. It affects about 15% to 20% of people, and is especially common in older adults.","['Buzzing', 'Roaring', 'Clicking', 'Hissing', 'Humming']","['Use hearing protection. Over time, exposure to loud sounds can damage the nerves in the ears, causing hearing loss and tinnitus. To keep your tinnitus from getting worse, take steps to protect your hearing. If you use chain saws, are a musician, work in an industry that uses loud machinery or use firearms (especially pistols or shotguns), always wear over-the-ear hearing protection.', 'Turn down the volume. Listening to music at very high volume through headphones can contribute to hearing loss and tinnitus.', ""Use white noise. If tinnitus is especially noticeable in quiet settings, try using a white noise machine to mask the noise from tinnitus. If you don't have a white noise machine, a fan, soft music or low-volume radio static also may help."", 'Limit alcohol, caffeine and nicotine. These substances, especially when used in excess, can affect blood flow and contribute to tinnitus.']"
255,Ringworm (body),https://www.mayoclinic.org/diseases-conditions/ringworm-body/symptoms-causes/syc-20353780,"Ringworm of the body (tinea corporis) is a rash caused by a fungal infection. It's usually an itchy, circular rash with clearer skin in the middle. Ringworm gets its name because of its appearance. No worm is involved.","['A scaly ring-shaped area, typically on the buttocks, trunk, arms and legs', 'Itchiness', 'A clear or scaly area inside the ring, perhaps with a scattering of bumps whose color ranges from red on white skin to reddish, purplish, brown or gray on black and brown skin', 'Slightly raised, expanding rings', 'A round, flat patch of itchy skin', 'Overlapping rings']","['Keep the affected area clean and dry.', 'Apply an over-the-counter antifungal lotion, cream or ointment such as clotrimazole (Lotrimin AF) or terbinafine (Lamisil AT) as directed on the packaging.']"
256,Ringworm (scalp),https://www.mayoclinic.org/diseases-conditions/ringworm-scalp/symptoms-causes/syc-20354918,"Ringworm of the scalp (tinea capitis) is a rash caused by a fungal infection. It usually causes itchy, scaly, bald patches on the head. Ringworm gets its name because of its circular appearance. No worm is involved.","['One or more round, scaly or inflamed patches where the hair has broken off at or near the scalp', 'Patches that slowly get bigger and have small, black dots where the hair has broken off', 'Brittle or fragile hair that can be easily broken or pulled out', 'Tender or painful areas on the scalp']",[]
257,"Ringworm of the foot, also known as
Athlete's foot",https://www.mayoclinic.org/diseases-conditions/athletes-foot/symptoms-causes/syc-20353841,Athlete's foot (tinea pedis) is a fungal skin infection that usually begins between the toes. It commonly occurs in people whose feet have become very sweaty while confined within tight-fitting shoes.,"['Scaly, peeling or cracked skin between the toes', 'Itchiness, especially right after taking off shoes and socks', 'Inflamed skin that might appear reddish, purplish or grayish, depending on your skin color', 'Burning or stinging', 'Blisters', 'Dry, scaly skin on the bottom of the foot that extends up the side']","['Keep your feet clean and dry. Wash your feet twice a day and gently towel-dry between the toes.', 'Use an antifungal product. After washing and drying your feet, apply an antifungal product. The antifungal terbinafine (Lamisil AT) has been shown to be very effective. Another option is clotrimazole (Lotrimin AF). You may need to experiment to find the product and formulation — ointment, gel, cream, lotion, powder or spray — that work for you. Apply the product to the affected skin as directed — usually twice a day until a week after the rash clears up. It might take 2 to 4 weeks to see results. If the condition comes back, you might need to start applying the product again.', 'Change socks regularly. Change your socks at least once a day — more often if your feet get really sweaty.', 'Wear light, well-ventilated footwear. Avoid shoes made of synthetic material, such as vinyl or rubber. Wear sandals when possible to let your feet air out.', 'Alternate pairs of shoes. Use different shoes from day to day. This gives your shoes time to dry after each use.', 'Protect your feet in public places. Wear waterproof sandals or shoes around public pools, showers and lockers rooms.', 'Try not to scratch the rash. You can try soothing your itchy feet by soaking them in cool water.', ""Don't share shoes. Sharing risks spreading a fungal infection.""]"
