,disease,link,overview,symptoms,remedies
346,"Shoulder dislocation, also known as
Dislocated shoulder",https://www.mayoclinic.org/diseases-conditions/dislocated-shoulder/symptoms-causes/syc-20371715,"A dislocated shoulder is an injury in which the upper arm bone pops out of the cup-shaped socket that's part of the shoulder blade. The shoulder is the body's most flexible joint, which makes it more likely to dislocate.","['A visibly deformed or out-of-place shoulder', 'Swelling or bruising', 'Intense pain', 'Inability to move the joint']","[""Rest the shoulder. Don't repeat the specific action that caused the shoulder to dislocate. Try to avoid painful movements. Limit heavy lifting or overhead activity until the shoulder feels better."", 'Apply ice then heat. Putting ice on the shoulder helps reduce inflammation and pain. Use a cold pack, a bag of frozen vegetables or a towel filled with ice cubes for 15 to 20 minutes at a time. Do this every couple of hours the first day or two.', 'Take pain relievers. Medications such as aspirin, ibuprofen (Advil, Motrin IB, others), naproxen sodium (Aleve) or acetaminophen (Tylenol, others) might help relieve pain. Follow label directions and stop taking the drugs when the pain improves.', ""Maintain the range of motion of the shoulder. After one or two days, your health care provider might have you do some gentle exercises to help maintain the shoulder's range of motion. Being inactive can cause joints to stiffen.""]"
347,"Shy-Drager syndrome, also known as
Multiple system atrophy (MSA)",https://www.mayoclinic.org/diseases-conditions/multiple-system-atrophy/symptoms-causes/syc-20356153,"Multiple system atrophy (MSA) is a rare, degenerative neurological disorder affecting your body's involuntary (autonomic) functions, including blood pressure, and motor control.","['Stiff muscles', 'Difficulty bending your arms and legs', 'Slow movement (bradykinesia)', 'Tremors can occur at rest or when moving your arms or legs', 'Soft voice', 'Problems with posture and balance']","['Taking steps to raise your blood pressure. Add a little salt to your diet and drink more fluids, especially before exercise. Salt and fluids can increase blood volume and raise your blood pressure. Drink coffee and other caffeinated fluids to raise your blood pressure.', 'Elevating the head of your bed. Raising the head of your bed by about 4 to 6 inches will minimize increases in blood pressure when you sleep. Get up slowly from a reclining position.', 'Making dietary changes. Add more fiber to your diet in order to ease constipation. You may also benefit from over-the-counter laxatives or stool softeners. Eat small, low-carbohydrate meals.', 'Avoiding getting too hot. Stay in air-conditioned rooms on very hot days. Avoid excessive amounts of heat in the bathroom when bathing.', 'Wearing elastic support stockings up to your waist. This can help keep your blood pressure from dropping.']"
348,"SIBO, also known as
Small intestinal bacterial overgrowth (SIBO)",https://www.mayoclinic.org/diseases-conditions/small-intestinal-bacterial-overgrowth/symptoms-causes/syc-20370168,Small intestinal bacterial overgrowth (SIBO) occurs when there is an abnormal increase in the overall bacterial population in the small intestine — particularly types of bacteria not commonly found in that part of the digestive tract. This condition is sometimes called blind loop syndrome.,"['Loss of appetite', 'Abdominal pain', 'Nausea', 'Bloating', 'An uncomfortable feeling of fullness after eating', 'Diarrhea', 'Unintentional weight loss', 'Malnutrition']",[]
349,Sick sinus syndrome,https://www.mayoclinic.org/diseases-conditions/sick-sinus-syndrome/symptoms-causes/syc-20377554,"Sick sinus syndrome is a type of heart rhythm disorder. It affects the heart's natural pacemaker (sinus node), which controls the heartbeat. Sick sinus syndrome causes slow heartbeats, pauses (long periods between heartbeats) or irregular heartbeats (arrhythmias).","['A sensation of rapid, fluttering heartbeats (palpitations)', 'Chest pain or discomfort', 'Confusion', 'Dizziness or lightheadedness', 'Fainting or near fainting', 'Fatigue', 'Shortness of breath', 'Slower pulse (bradycardia)']","['Eat a healthy diet. Choose generous portions of nonstarchy vegetables, fruits and whole grains and modest portions of fish, lean meats, poultry and dairy.', 'Exercise and maintain a healthy weight. Being overweight increases the risk of developing heart disease. Unless your provider tells you otherwise, aim for at least 30 minutes of moderate physical activity every day. Ask your health care provider what your goal weight should be.', 'Keep blood pressure and cholesterol under control. Make lifestyle changes and take medications as prescribed to manage high blood pressure or high cholesterol.', ""Don't smoke. If you smoke and can't quit on your own, talk to your health care provider about ways or programs to help break a smoking habit."", ""If you drink, do so in moderation. For some conditions it's recommended that you completely avoid alcohol. Ask your health care provider for advice specific to your condition. If you can't control your alcohol use, talk to your provider about a program to quit drinking and manage other behaviors related to alcohol use."", ""Don't use illegal drugs. Talk to your provider about a program if you need help quitting."", 'Control stress. Getting more exercise, practicing mindfulness and connecting with others in support groups are some ways to reduce stress.', 'Go to scheduled checkups. Have regular physical exams and report any signs or symptoms to your health care provider.']"
350,Sickle cell anemia,https://www.mayoclinic.org/diseases-conditions/sickle-cell-anemia/symptoms-causes/syc-20355876,"Sickle cell anemia is one of a group of inherited disorders known as sickle cell disease. It affects the shape of red blood cells, which carry oxygen to all parts of the body.","[""Anemia. Sickle cells break apart easily and die. Red blood cells usually live for about 120 days before they need to be replaced. But sickle cells typically die in 10 to 20 days, leaving a shortage of red blood cells (anemia). Without enough red blood cells, the body can't get enough oxygen and this causes fatigue."", 'Episodes of pain. Periodic episodes of extreme pain, called pain crises, are a major symptom of sickle cell anemia. Pain develops when sickle-shaped red blood cells block blood flow through tiny blood vessels to your chest, abdomen and joints.\nThe pain varies in intensity and can last for a few hours to a few days. Some people have only a few pain crises a year. Others have a dozen or more a year. A severe pain crisis requires a hospital stay.\nSome adolescents and adults with sickle cell anemia also have chronic pain, which can result from bone and joint damage, ulcers, and other causes.', 'Swelling of hands and feet. The swelling is caused by sickle-shaped red blood cells blocking blood circulation in the hands and feet.', 'Frequent infections. Sickle cells can damage the spleen, increasing vulnerability to infections. Infants and children with sickle cell anemia commonly receive vaccinations and antibiotics to prevent potentially life-threatening infections, such as pneumonia.', 'Delayed growth or puberty. Red blood cells provide the body with the oxygen and nutrients needed for growth. A shortage of healthy red blood cells can slow growth in infants and children and delay puberty in teenagers.', 'Vision problems. Tiny blood vessels that supply the eyes can become plugged with sickle cells. This can damage the retina — the portion of the eye that processes visual images — and lead to vision problems.']","['Take folic acid supplements daily and choose a healthy diet. Bone marrow needs folic acid and other vitamins to make new red blood cells. Ask your doctor about a folic acid supplement and other vitamins. Eat a variety of colorful fruits and vegetables, as well as whole grains.', 'Drink plenty of water. Dehydration can increase your risk of a sickle cell crisis. Drink water throughout your day, aiming for about eight glasses a day. Increase the amount of water you drink if you exercise or spend time in a hot, dry climate.', 'Avoid temperature extremes. Exposure to extreme heat or cold can increase your risk of a sickle cell crisis.', ""Exercise regularly, but don't overdo it. Talk with your doctor about how much exercise is right for you."", ""Use nonprescription medications with caution. Use pain medications, such as ibuprofen (Advil, Motrin IB, Children's Motrin, others) or naproxen sodium (Aleve), sparingly, if at all, because of the possible effect on your kidneys. Ask your doctor before taking nonprescription drugs."", ""Don't smoke. Smoking increases your risk of pain crises.""]"
351,"SIDS, also known as
Sudden infant death syndrome (SIDS)",https://www.mayoclinic.org/diseases-conditions/sudden-infant-death-syndrome/symptoms-causes/syc-20352800,"Sudden infant death syndrome (SIDS) is the unexplained death, usually during sleep, of a seemingly healthy baby less than a year old. SIDS is sometimes known as crib death because the infants often die in their cribs.",[],[]
352,"Sin Nombre virus infection, also known as
Hantavirus pulmonary syndrome",https://www.mayoclinic.org/diseases-conditions/hantavirus-pulmonary-syndrome/symptoms-causes/syc-20351838,Hantavirus pulmonary syndrome is a rare infectious disease that begins with flu-like symptoms and progresses rapidly to more severe disease. It can lead to life-threatening lung and heart problems. The disease is also called hantavirus cardiopulmonary syndrome.,"['Fever and chills', 'Muscle aches or pain', 'Headache']",[]
353,Sinus headaches,https://www.mayoclinic.org/diseases-conditions/sinus-headaches/symptoms-causes/syc-20377580,"Sinus headaches are headaches that may feel like an infection in the sinuses (sinusitis). You may feel pressure around the eyes, cheeks and forehead. Perhaps your head throbs.","['Pain, pressure and fullness in the cheeks, brow or forehead', 'Worsening pain if you bend forward or lie down', 'Stuffy nose', 'Fatigue', 'Achy feeling in the upper teeth']",[]
354,"Sinusitis, acute, also known as
Acute sinusitis",https://www.mayoclinic.org/diseases-conditions/acute-sinusitis/symptoms-causes/syc-20351671,Acute sinusitis causes the spaces inside your nose (sinuses) to become inflamed and swollen. This interferes with drainage and causes mucus to build up.,"['Thick, yellow or greenish mucus from the nose (runny nose) or down the back of the throat (postnasal drainage)', 'Blocked or stuffy nose (congestion) causing difficulty breathing through your nose', 'Pain, tenderness, swelling and pressure around your eyes, cheeks, nose or forehead that worsens when bending over']","['Rest. This will help your body fight infection and speed recovery.', 'Drink fluids. Continue to drink plenty of fluids.', 'Use a warm compress. A warm compress on your nose and forehead may help relieve the pressure in your sinuses.', 'Moisten your sinus cavities. Drape a towel over your head as you breathe in the vapor from a bowl of hot water. Keep the vapor directed toward your face. Or take a hot shower, breathing in the warm, moist air. This will help ease pain and help mucus drain.', 'Rinse your nasal passages. Use a specially designed squeeze bottle (Sinus Rinse, others) or neti pot. This home remedy, called nasal lavage, can help clear your sinuses.']"
355,"Sinusitis, chronic, also known as
Chronic sinusitis",https://www.mayoclinic.org/diseases-conditions/chronic-sinusitis/symptoms-causes/syc-20351661,"Chronic sinusitis occurs when the spaces inside your nose and head (sinuses) are swollen and inflamed for three months or longer, despite treatment.","['Nasal inflammation', 'Thick, discolored discharge from the nose (runny nose)', 'Drainage down the back of the throat (postnasal drainage)', 'Blocked or stuffy (congested) nose causing difficulty breathing through your nose', 'Pain, tenderness and swelling around your eyes, cheeks, nose or forehead', 'Reduced sense of smell and taste']","['Rest. This can help your body fight inflammation and speed recovery.', 'Moisturize your sinuses. Drape a towel over your head as you breathe in the vapor from a bowl of medium-hot water. Keep the vapor directed toward your face. Or take a hot shower, breathing in the warm, moist air to help ease pain and help mucus drain.', 'Warm compress. A warm compress on your nose and forehead may help relieve the pressure in your sinuses.', 'Rinse out your nasal passages. Use a specially designed squeeze bottle, saline canister or neti pot to rinse your nasal passages. This home remedy, called nasal lavage, can help clear your sinuses.']"
356,Sjogren's syndrome,https://www.mayoclinic.org/diseases-conditions/sjogrens-syndrome/symptoms-causes/syc-20353216,Sjogren's (SHOW-grins) syndrome is a disorder of your immune system identified by its two most common symptoms — dry eyes and a dry mouth.,"[""Dry eyes. Your eyes might burn, itch or feel gritty — as if there's sand in them."", ""Dry mouth. Your mouth might feel like it's full of cotton, making it difficult to swallow or speak.""]","[""Use artificial tears, an eye lubricant or both. Artificial tears — in eyedrop form — and eye lubricants — in eyedrop, gel or ointment form — help relieve the discomfort of dry eyes. You don't have to apply eye lubricants as often as artificial tears. Because of their thicker consistency, eye lubricants can blur your vision and collect on your eyelashes, so you might want to use them only overnight.\nYour doctor might recommend artificial tears without preservatives, which can irritate the eyes of people with dry eye syndrome."", 'Increase humidity. Increasing the indoor humidity and reducing your exposure to blowing air can help keep your eyes and mouth from getting uncomfortably dry. For example, avoid sitting in front of a fan or air conditioning vent, and wear goggles or protective eyewear when you go outdoors.']"
357,Skin cancer,https://www.mayoclinic.org/diseases-conditions/skin-cancer/symptoms-causes/syc-20377605,Skin cancer — the abnormal growth of skin cells — most often develops on skin exposed to the sun. But this common form of cancer can also occur on areas of your skin not ordinarily exposed to sunlight.,"['A pearly or waxy bump', 'A flat, flesh-colored or brown scar-like lesion', 'A bleeding or scabbing sore that heals and returns']",[]
358,"Skin cancer, melanoma, also known as
Melanoma",https://www.mayoclinic.org/diseases-conditions/melanoma/symptoms-causes/syc-20374884,"Melanoma, the most serious type of skin cancer, develops in the cells (melanocytes) that produce melanin — the pigment that gives your skin its color. Melanoma can also form in your eyes and, rarely, inside your body, such as in your nose or throat.","['A change in an existing mole', 'The development of a new pigmented or unusual-looking growth on your skin']",[]
359,"Skin, itchy, also known as
Itchy skin (pruritus)",https://www.mayoclinic.org/diseases-conditions/itchy-skin/symptoms-causes/syc-20355006,"Itchy skin is an uncomfortable, irritating sensation that makes you want to scratch. Also known as pruritus (proo-RIE-tus), itchy skin is often caused by dry skin. It's common in older adults, as skin tends to become drier with age.","['Redness', 'Scratch marks', 'Bumps, spots or blisters', 'Dry, cracked skin', 'Leathery or scaly patches']","[""Avoid items or situations that cause you to itch. Try to identify what's causing your symptoms and avoid it. This might be wool clothing, an overly heated room, too many hot baths or exposure to a cleaning product."", 'Moisturize daily. Apply hypoallergenic and fragrance-free moisturizer (Cetaphil, others) to affected skin at least once a day. For dry skin, thicker creams and ointments work better than lotions.', ""Treat the scalp. For a dry, itchy scalp, try over-the-counter medicated shampoos containing zinc pyrithione (Head & Shoulders, others), ketoconazole (Nizoral, others), selenium sulfide (Selsun Blue, others) or coal tar (Neutrogena T/Gel, others). You might need to try several products before finding one that works for your hair and condition. Or you may find that alternating between products helps. Don't use a medicated shampoo right after having a chemical relaxing process — rather, use a neutralizing shampoo."", 'Reduce stress or anxiety. Stress or anxiety can worsen itching. Many people have found that techniques such as counseling, behavior modification therapy, acupuncture, meditation and yoga can help reduce stress or anxiety.', 'Try over-the-counter oral allergy medicine. Some OTC allergy medicines (antihistamines), such as diphenhydramine, can make you drowsy. This type of pill might be helpful before bedtime if your itchy skin disrupts your sleep. Antihistamines do not help with the itch that follows a shingles infection.', 'Use a humidifier. A humidifier may provide some relief if home heating causes the air in your home to be dry.', 'Use creams, lotions or gels that soothe and cool the skin. Short-term use of nonprescription corticosteroid cream may temporarily relieve an itch accompanied by red, inflamed skin. Or try calamine lotion or creams with menthol (Sarna, others), camphor, capsaicin, or a topical anesthetic, such as pramoxine (adults only). Keeping these products in the refrigerator can enhance their soothing effect. Corticosteroid creams do not help with the itch that follows a shingles infection.', ""Avoid scratching. Cover the itchy area if you can't keep from scratching it. Trim your nails and, if it helps, wear gloves when you sleep."", ""Take a bath. Use lukewarm water and sprinkle in about a half cup (100 grams) of Epsom salts, baking soda or an oatmeal-based bath product (Aveeno, others). Use a mild cleanser (Dove, Olay, Cetaphil), limiting its use to the underarms and groin. Don't scrub too hard and limit your bathing time. Then rinse thoroughly, pat dry and moisturize."", 'Stay well rested. Getting enough sleep might reduce the risk of itchy skin.']"
360,"Skipped heartbeats, also known as
Heart palpitations",https://www.mayoclinic.org/diseases-conditions/heart-palpitations/symptoms-causes/syc-20373196,"Heart palpitations (pal-pih-TAY-shuns) are feelings of having a fast-beating, fluttering or pounding heart. Stress, exercise, medication or, rarely, a medical condition can trigger them.","['Beating too fast', 'Flip-flopping', 'Fluttering rapidly', 'Pounding', 'Skipping beats']","['Reduce stress. Try relaxation techniques, such as meditation, yoga or deep breathing.', 'Avoid stimulants. Caffeine, nicotine, some cold medicines and energy drinks can make the heart beat too fast or irregularly.', 'Avoid illegal drugs. Certain drugs, such as cocaine and amphetamines, can cause heart palpitations.']"
361,"Slapped cheek disease, also known as
Parvovirus infection",https://www.mayoclinic.org/diseases-conditions/parvovirus-infection/symptoms-causes/syc-20376085,"Parvovirus infection is a common and highly contagious childhood illness. It's sometimes called slapped-cheek disease because of the distinctive face rash that develops. Parvovirus infection has also been known as fifth disease because, historically, it was fifth in a list of common childhood illnesses characterized by a rash.","['Fever', 'Upset stomach', 'Headache', 'Runny nose']","['When and how you or your child was exposed to parvovirus', 'A detailed description of symptoms', 'Medical problems that run in your family', 'Medical problems you or your child has had in the past', 'All the drugs and supplements you or your child takes']"
362,Sleep apnea,https://www.mayoclinic.org/diseases-conditions/sleep-apnea/symptoms-causes/syc-20377631,"Sleep apnea is a potentially serious sleep disorder in which breathing repeatedly stops and starts. If you snore loudly and feel tired even after a full night's sleep, you might have sleep apnea.","['Loud snoring', 'Episodes in which you stop breathing during sleep — which would be reported by another person', 'Gasping for air during sleep', 'Awakening with a dry mouth', 'Morning headache', 'Difficulty staying asleep (insomnia)', 'Excessive daytime sleepiness (hypersomnia)', 'Difficulty paying attention while awake', 'Irritability']","['Lose excess weight. Even a slight weight loss might help relieve constriction of your throat. In some cases, sleep apnea can resolve if you return to a healthy weight, but it can recur if you regain the weight.', 'Exercise. Regular exercise can help ease the symptoms of obstructive sleep apnea even without weight loss. Try to get 30 minutes of moderate activity, such as a brisk walk, most days of the week.', 'Avoid alcohol and certain medications such as tranquilizers and sleeping pills. These relax the muscles in the back of your throat, interfering with breathing.', 'Sleep on your side or abdomen rather than on your back. Sleeping on your back can cause your tongue and soft palate to rest against the back of your throat and block your airway. To keep from rolling onto your back while you sleep, try attaching a tennis ball to the back of your pajama top. There are also commercial devices that vibrate when you roll onto your back in sleep.', ""Don't smoke. If you're a smoker, look for resources to help you quit.""]"
363,"Sleep apnea in children, obstructive, also known as
Pediatric obstructive sleep apnea",https://www.mayoclinic.org/diseases-conditions/pediatric-sleep-apnea/symptoms-causes/syc-20376196,Pediatric obstructive sleep apnea is a sleep disorder in which your child's breathing is partially or completely blocked repeatedly during sleep. The condition is due to narrowing or blockage of the upper airway during sleep.,"['Snoring', 'Pauses in breathing', 'Restless sleep', 'Snorting, coughing or choking', 'Mouth breathing', 'Nighttime sweating', 'Bed-wetting', 'Sleep terrors']","['Avoid airway irritants and allergens. All children, but especially those with pediatric obstructive sleep apnea, should be kept away from exposure to tobacco smoke or other indoor allergens or pollutants, as they can cause airway irritation and congestion.', 'Weight loss. Doctors may recommend that your child lose weight if he or she is obese. Your doctor can provide you and your child with diet and nutrition information, or refer your child to other specialists with expertise in managing obesity.']"
364,"Sleep apnea, central, also known as
Central sleep apnea",https://www.mayoclinic.org/diseases-conditions/central-sleep-apnea/symptoms-causes/syc-20352109,Central sleep apnea is a disorder in which your breathing repeatedly stops and starts during sleep.,"['Observed episodes of not breathing or abnormal breathing patterns during sleep', 'Abrupt awakenings accompanied by shortness of breath', 'Difficulty staying asleep (insomnia)', 'Excessive daytime sleepiness (hypersomnia)', 'Difficulty concentrating', 'Mood changes', 'Morning headaches', 'Snoring']",[]
365,"Sleep apnea, obstructive, also known as
Obstructive sleep apnea",https://www.mayoclinic.org/diseases-conditions/obstructive-sleep-apnea/symptoms-causes/syc-20352090,Obstructive sleep apnea is the most common sleep-related breathing disorder. It causes you to repeatedly stop and start breathing while you sleep.,"['Excessive daytime sleepiness', 'Loud snoring', 'Observed episodes of stopped breathing during sleep', 'Abrupt awakenings accompanied by gasping or choking', 'Awakening with a dry mouth or sore throat', 'Morning headache', 'Difficulty concentrating during the day', 'Mood changes, such as depression or irritability', 'High blood pressure', 'Decreased libido']","[""Lose weight. If you're overweight or obese, even a moderate loss of excess weight may help relieve constriction of your airway. Losing weight can also improve your health and quality of life and might reduce your daytime sleepiness."", 'Exercise. Exercising, such as aerobic exercise and strength training, can help improve your condition. Aim to exercise about 150 minutes a week, and generally try to exercise most days of the week.', 'Avoid alcohol and medications such as anti-anxiety drugs and sleeping pills. Alcohol, some anti-anxiety medications, and some sleeping pills can worsen obstructive sleep apnea and sleepiness.', 'Sleep on your side or stomach rather than on your back. Sleeping on your back can cause your tongue and soft palate to rest against the back of your throat and block your airway.\nTo prevent sleeping on your back, try sewing a tennis ball in the back of your pajama top or place pillows behind you while you sleep on your side.', 'Keep your nasal passages open while you sleep. If you have congestion, use a saline nasal spray to help keep your nasal passages open. Talk to your doctor about using nasal decongestants or antihistamines, because some medications may be recommended for only short-term use.']"
366,Sleep disorders,https://www.mayoclinic.org/diseases-conditions/sleep-disorders/symptoms-causes/syc-20354018,Sleep disorders are conditions that result in changes in the way that you sleep.,[],[]
