,disease,link,overview,symptoms,remedies
133,"Prader-Labhart-Willi syndrome, also known as
Prader-Willi syndrome",https://www.mayoclinic.org/diseases-conditions/prader-willi-syndrome/symptoms-causes/syc-20355997,"Prader-Willi (PRAH-dur VIL-e) syndrome is a rare genetic disorder that results in a number of physical, mental and behavioral problems. A key feature of Prader-Willi syndrome is a constant sense of hunger that usually begins at about 2 years of age.","[""Poor muscle tone. A primary sign during infancy is poor muscle tone (hypotonia). Babies may rest with their elbows and knees loosely extended instead of fixed, and they may feel floppy or like rag dolls when they're held."", 'Distinct facial features. Children may be born with almond-shaped eyes, a narrowing of the head at the temples, a turned-down mouth and a thin upper lip.', 'Poor sucking reflex. Infants may have a poor sucking reflex due to decreased muscle tone. Poor sucking makes feeding difficult and can result in failure to thrive.', 'Generally poor responsiveness. A baby may seem unusually tired, respond poorly to stimulation, have a hard time waking up or have a weak cry.', 'Underdeveloped genitals. Males may have a small penis and scrotum. The testicles may be small or not descended from the abdomen into the scrotum (cryptorchidism). In females, the clitoris and labia may be small.']","['Learn about Prader-Willi syndrome. Managing hormone levels and weight can improve development and behavior and prevent complications. Work with your health care team to develop a plan of care for managing symptoms and addressing issues.', ""Stick to a strict meal plan. Eating a low-calorie diet is essential to keep your child from becoming overweight. Structure mealtime and the type of food to help develop routines and to help your child understand expectations. Use small dishes for serving meals. To help prevent binging, avoid buying high-calorie snacks. Store food out of your child's reach. Lock pantries, refrigerators and cupboards."", 'Encourage regular daily activity. Increasing physical activity and exercise can help manage weight and improve physical functioning.', 'Set limits. Create a firm schedule and set expectations for managing behavior. If needed, talk to your health care team about ways to address problems.', 'Schedule regular medical care. Talk with your doctor about a regular schedule of health appointments and tests to check for problems or complications related to Prader-Willi syndrome.']"
134,Prader-Willi syndrome,https://www.mayoclinic.org/diseases-conditions/prader-willi-syndrome/symptoms-causes/syc-20355997,"Prader-Willi (PRAH-dur VIL-e) syndrome is a rare genetic disorder that results in a number of physical, mental and behavioral problems. A key feature of Prader-Willi syndrome is a constant sense of hunger that usually begins at about 2 years of age.","[""Poor muscle tone. A primary sign during infancy is poor muscle tone (hypotonia). Babies may rest with their elbows and knees loosely extended instead of fixed, and they may feel floppy or like rag dolls when they're held."", 'Distinct facial features. Children may be born with almond-shaped eyes, a narrowing of the head at the temples, a turned-down mouth and a thin upper lip.', 'Poor sucking reflex. Infants may have a poor sucking reflex due to decreased muscle tone. Poor sucking makes feeding difficult and can result in failure to thrive.', 'Generally poor responsiveness. A baby may seem unusually tired, respond poorly to stimulation, have a hard time waking up or have a weak cry.', 'Underdeveloped genitals. Males may have a small penis and scrotum. The testicles may be small or not descended from the abdomen into the scrotum (cryptorchidism). In females, the clitoris and labia may be small.']","['Learn about Prader-Willi syndrome. Managing hormone levels and weight can improve development and behavior and prevent complications. Work with your health care team to develop a plan of care for managing symptoms and addressing issues.', ""Stick to a strict meal plan. Eating a low-calorie diet is essential to keep your child from becoming overweight. Structure mealtime and the type of food to help develop routines and to help your child understand expectations. Use small dishes for serving meals. To help prevent binging, avoid buying high-calorie snacks. Store food out of your child's reach. Lock pantries, refrigerators and cupboards."", 'Encourage regular daily activity. Increasing physical activity and exercise can help manage weight and improve physical functioning.', 'Set limits. Create a firm schedule and set expectations for managing behavior. If needed, talk to your health care team about ways to address problems.', 'Schedule regular medical care. Talk with your doctor about a regular schedule of health appointments and tests to check for problems or complications related to Prader-Willi syndrome.']"
135,Precocious puberty,https://www.mayoclinic.org/diseases-conditions/precocious-puberty/symptoms-causes/syc-20351811,"Precocious puberty is when a child's body begins changing into that of an adult (puberty) too soon. When puberty begins before age 8 in girls and before age 9 in boys, it is considered precocious puberty.","['Breast growth and first period in girls', 'Enlarged testicles and penis, facial hair and deepening voice in boys', 'Pubic or underarm hair', 'Rapid growth', 'Acne', 'Adult body odor']",[]
136,Prediabetes,https://www.mayoclinic.org/diseases-conditions/prediabetes/symptoms-causes/syc-20355278,"Prediabetes means you have a higher than normal blood sugar level. It's not high enough to be considered type 2 diabetes yet. But without lifestyle changes, adults and children with prediabetes are at high risk to develop type 2 diabetes.","['Increased thirst', 'Frequent urination', 'Increased hunger', 'Fatigue', 'Blurred vision', 'Numbness or tingling in the feet or hands', 'Frequent infections', 'Slow-healing sores', 'Unintended weight loss']",[]
137,Preeclampsia,https://www.mayoclinic.org/diseases-conditions/preeclampsia/symptoms-causes/syc-20355745,"Preeclampsia is a complication of pregnancy. With preeclampsia, you might have high blood pressure, high levels of protein in urine that indicate kidney damage (proteinuria), or other signs of organ damage. Preeclampsia usually begins after 20 weeks of pregnancy in women whose blood pressure had previously been in the standard range.","['Excess protein in urine (proteinuria) or other signs of kidney problems', 'Decreased levels of platelets in blood (thrombocytopenia)', 'Increased liver enzymes that indicate liver problems', 'Severe headaches', 'Changes in vision, including temporary loss of vision, blurred vision or light sensitivity', 'Shortness of breath, caused by fluid in the lungs', 'Pain in the upper belly, usually under the ribs on the right side', 'Nausea or vomiting']",[]
138,"Preexcitation syndrome, also known as
Wolff-Parkinson-White (WPW) syndrome",https://www.mayoclinic.org/diseases-conditions/wolff-parkinson-white-syndrome/symptoms-causes/syc-20354626,"In Wolff-Parkinson-White (WPW) syndrome, an extra signaling pathway between the heart's upper and lower chambers causes a fast heartbeat (tachycardia). WPW syndrome is a heart condition present at birth (congenital heart defect). It is fairly rare.","['A rapid, fluttering or pounding heartbeat (palpitations)', 'Chest pain', 'Difficulty breathing', 'Dizziness or lightheadedness', 'Fainting', 'Fatigue', 'Shortness of breath', 'Anxiety']","['Avoid caffeine or other stimulants.', ""Don't smoke."", 'Eat a healthy diet.', 'Get regular exercise.', 'Limit or avoid alcohol.', 'Maintain a healthy weight.', 'Manage emotional stress.']"
139,"Pregnancy-related hypertension, also known as
Preeclampsia",https://www.mayoclinic.org/diseases-conditions/preeclampsia/symptoms-causes/syc-20355745,"Preeclampsia is a complication of pregnancy. With preeclampsia, you might have high blood pressure, high levels of protein in urine that indicate kidney damage (proteinuria), or other signs of organ damage. Preeclampsia usually begins after 20 weeks of pregnancy in women whose blood pressure had previously been in the standard range.","['Excess protein in urine (proteinuria) or other signs of kidney problems', 'Decreased levels of platelets in blood (thrombocytopenia)', 'Increased liver enzymes that indicate liver problems', 'Severe headaches', 'Changes in vision, including temporary loss of vision, blurred vision or light sensitivity', 'Shortness of breath, caused by fluid in the lungs', 'Pain in the upper belly, usually under the ribs on the right side', 'Nausea or vomiting']",[]
140,Premature birth,https://www.mayoclinic.org/diseases-conditions/premature-birth/symptoms-causes/syc-20376730,"A premature birth is a birth that takes place more than three weeks before the baby's estimated due date. In other words, a premature birth is one that occurs before the start of the 37th week of pregnancy.","['Small size, with a disproportionately large head', ""Sharper looking, less rounded features than a full-term baby's features, due to a lack of fat stores"", 'Fine hair (lanugo) covering much of the body', 'Low body temperature, especially immediately after birth in the delivery room, due to a lack of stored body fat', 'Labored breathing or respiratory distress', 'Lack of reflexes for sucking and swallowing, leading to feeding difficulties']","[""Understand how to care for your baby. Before you leave the hospital, take a course in infant CPR. Ask your baby's medical team any questions you might have and take notes.\nMake sure you're comfortable caring for your baby, especially if you'll need to administer medications, use special monitors, or give your baby supplemental oxygen or other treatments. Discuss symptoms — such as infant breathing or feeding problems — that might necessitate a call to your baby's care provider."", ""Discuss feedings. Ask the medical team about your baby's need for supplementation in the form of breast milk fortifiers or preterm infant formula. Keep in mind that premature babies usually eat less and may need to be fed more often than full-term babies. Find out how much and how often your baby should be eating."", ""Protect your baby's health. Premature babies are more susceptible to serious infections than are other newborns. Try to minimize your baby's exposure to crowded places, and make sure everyone who comes into contact with your baby washes his or her hands first. Ask people who are ill to postpone their visit until they are well.\nBecause premature babies are especially at risk of a serious infection of the lungs and respiratory tract (respiratory syncytial virus, or RSV), your baby's doctor might recommend a preventive medication called palivizumab (Synagis), which helps protect your baby from this serious infection."", ""Follow a recommended schedule for checkups. Discuss your baby's need for future appointments with your baby's care provider and any specialists. Your preterm baby may initially need to see his or her care provider every week or two to have his or her growth, medical needs and care monitored."", ""Stay on top of vaccinations. While it's recommended that immunizations be given to medically stable premature babies according to their chronological age, delays in the immunization schedule are common. Work with your baby's care provider to stay on top of your baby's vaccinations.\nYou may also protect your preterm infant by ensuring that others in the home are up to date on their immunizations, including influenza. Pregnant women, family members and adult caregivers should also check with their doctors to be sure they're up to date on their whooping cough (pertussis) vaccine."", ""Monitor for developmental delays. Your baby's care provider may also monitor your baby for developmental delays and disabilities in the coming months. Babies who are identified as at risk may receive further evaluation and be referred to early intervention services. Eligibility for such programs varies by state.""]"
141,Premature ejaculation,https://www.mayoclinic.org/diseases-conditions/premature-ejaculation/symptoms-causes/syc-20354900,Premature ejaculation occurs in men when semen leave the body (ejaculate) sooner than wanted during sex. Premature ejaculation is a common sexual complaint. As many as 1 out of 3 people say they have it at some time.,"['Lifelong. Lifelong premature ejaculation occurs all or nearly all the time beginning with the first sexual encounter.', 'Acquired. Acquired premature ejaculation develops after having previous sexual experiences without problems with ejaculation.']",[]
142,"Premature ovarian failure, also known as
Primary ovarian insufficiency",https://www.mayoclinic.org/diseases-conditions/premature-ovarian-failure/symptoms-causes/syc-20354683,"Primary ovarian insufficiency occurs when the ovaries stop functioning as they should before age 40. When this happens, your ovaries don't produce typical amounts of the hormone estrogen or release eggs regularly. This condition is also called premature ovarian failure and often leads to infertility.","['Irregular or skipped periods, which might be present for years or develop after a pregnancy or after stopping birth control pills', 'Difficulty getting pregnant', 'Hot flashes', 'Night sweats', 'Vaginal dryness', 'Dry eyes', 'Irritability or difficulty concentrating', 'Decreased sexual desire']","[""Learn about alternatives for having children. If you'd like to add to your family, talk to your health care provider about options such as in vitro fertilization using donor eggs or adoption."", ""Talk with your provider about the best contraception options. A small percentage of women with primary ovarian insufficiency do spontaneously conceive. If you don't want to become pregnant, consider using birth control."", ""Keep your bones strong. Eat a calcium-rich diet, do weight-bearing exercises such as walking and strength training exercises for your upper body, and don't smoke. Ask your provider if you need calcium and vitamin D supplements."", 'Keep track of your menstrual cycle. If you miss a period while taking hormone therapy that causes you to have a monthly cycle, get a pregnancy test.']"
143,"Premature puberty, also known as
Precocious puberty",https://www.mayoclinic.org/diseases-conditions/precocious-puberty/symptoms-causes/syc-20351811,"Precocious puberty is when a child's body begins changing into that of an adult (puberty) too soon. When puberty begins before age 8 in girls and before age 9 in boys, it is considered precocious puberty.","['Breast growth and first period in girls', 'Enlarged testicles and penis, facial hair and deepening voice in boys', 'Pubic or underarm hair', 'Rapid growth', 'Acne', 'Adult body odor']",[]
144,Premature ventricular contractions (PVCs),https://www.mayoclinic.org/diseases-conditions/premature-ventricular-contractions/symptoms-causes/syc-20376757,"Premature ventricular contractions (PVCs) are extra heartbeats that begin in one of the heart's two lower pumping chambers (ventricles). These extra beats disrupt the regular heart rhythm, sometimes causing a sensation of a fluttering or a skipped beat in the chest.","['Fluttering', 'Pounding or jumping', 'Skipped beats or missed beats', 'Increased awareness of the heartbeat']","['Track your triggers. If you have frequent PVCs, keeping a diary of the day and timing of symptoms may be helpful. A diary may help identify foods, drinks or activities that trigger the premature ventricular contractions.', 'Modify your substance use. Caffeine, alcohol, tobacco and stimulant drugs are known triggers of premature ventricular contractions. Reducing or avoiding such items may reduce PVC symptoms.', 'Manage stress. Anxiety can trigger irregular heartbeats. Find ways to help reduce emotional stress. Getting more exercise, practicing mindfulness and connecting with others in support groups are some ways to tame stress. If you need help managing anxiety, talk to your health care provider about strategies and medications that may help.']"
145,"Premenstrual syndrome, also known as
Premenstrual syndrome (PMS)",https://www.mayoclinic.org/diseases-conditions/premenstrual-syndrome/symptoms-causes/syc-20376780,"Premenstrual syndrome (PMS) has a wide variety of signs and symptoms, including mood swings, tender breasts, food cravings, fatigue, irritability and depression. It's estimated that as many as 3 of every 4 menstruating women have experienced some form of premenstrual syndrome.","['Tension or anxiety', 'Depressed mood', 'Crying spells', 'Mood swings and irritability or anger', 'Appetite changes and food cravings', 'Trouble falling asleep (insomnia)', 'Social withdrawal', 'Poor concentration', 'Change in libido']","['Eat smaller, more-frequent meals to reduce bloating and the sensation of fullness.', 'Limit salt and salty foods to reduce bloating and fluid retention.', 'Choose foods high in complex carbohydrates, such as fruits, vegetables and whole grains.', ""Choose foods rich in calcium. If you can't tolerate dairy products or aren't getting adequate calcium in your diet, a daily calcium supplement may help."", 'Avoid caffeine and alcohol.']"
146,Premenstrual syndrome (PMS),https://www.mayoclinic.org/diseases-conditions/premenstrual-syndrome/symptoms-causes/syc-20376780,"Premenstrual syndrome (PMS) has a wide variety of signs and symptoms, including mood swings, tender breasts, food cravings, fatigue, irritability and depression. It's estimated that as many as 3 of every 4 menstruating women have experienced some form of premenstrual syndrome.","['Tension or anxiety', 'Depressed mood', 'Crying spells', 'Mood swings and irritability or anger', 'Appetite changes and food cravings', 'Trouble falling asleep (insomnia)', 'Social withdrawal', 'Poor concentration', 'Change in libido']","['Eat smaller, more-frequent meals to reduce bloating and the sensation of fullness.', 'Limit salt and salty foods to reduce bloating and fluid retention.', 'Choose foods high in complex carbohydrates, such as fruits, vegetables and whole grains.', ""Choose foods rich in calcium. If you can't tolerate dairy products or aren't getting adequate calcium in your diet, a daily calcium supplement may help."", 'Avoid caffeine and alcohol.']"
147,"Presbycusis, also known as
Hearing loss",https://www.mayoclinic.org/diseases-conditions/hearing-loss/symptoms-causes/syc-20373072,Hearing loss that occurs gradually as you age (presbycusis) is common. Almost half the people in the United States older than age 65 have some degree of hearing loss.,"['Muffling of speech and other sounds', 'Difficulty understanding words, especially against background noise or in a crowd', 'Trouble hearing consonants', 'Frequently asking others to speak more slowly, clearly and loudly', 'Needing to turn up the volume of the television or radio', 'Withdrawal from conversations', 'Avoidance of some social settings']",[]
148,Presbyopia,https://www.mayoclinic.org/diseases-conditions/presbyopia/symptoms-causes/syc-20363328,"Presbyopia is the gradual loss of your eyes' ability to focus on nearby objects. It's a natural, often annoying part of aging. Presbyopia usually becomes noticeable in your early to mid-40s and continues to worsen until around age 65.","['A tendency to hold reading material farther away to make the letters clearer', 'Blurred vision at normal reading distance', 'Eyestrain or headaches after reading or doing close-up work']","['Have your eyes checked. Do this regularly even if you see well.', ""Control chronic health conditions. Certain conditions, such as diabetes and high blood pressure, can affect your vision if you don't receive proper treatment."", 'Protect your eyes from the sun. Wear glasses or sunglasses that block ultraviolet (UV) radiation. This is especially important if you spend long hours in the sun or are taking a prescription medication that increases your sensitivity to UV radiation.', ""Prevent eye injuries. Wear protective eyewear when doing certain things, such as playing sports, mowing the lawn, or painting or using other products with toxic fumes. Nonprescription reading glasses generally don't provide safety protection."", ""Eat healthy foods. Try to eat plenty of fruits, leafy greens and other vegetables. These foods generally contain high levels of antioxidants as well as vitamin A and beta carotene. They're also vital to maintaining healthy vision."", 'Use the right glasses. The right glasses optimize your vision. Having regular exams will ensure that your eyeglass prescription is correct.', 'Use good lighting. Turn up or add light for better vision.', 'See your doctor immediately if you experience any of these symptoms — sudden loss of vision in one eye with or without pain, sudden hazy or blurred vision, double vision, or see flashes of light, black spots or halos around lights. Any of these symptoms may signal a serious medical or eye condition.']"
149,Prescription drug abuse,https://www.mayoclinic.org/diseases-conditions/prescription-drug-abuse/symptoms-causes/syc-20376813,"Prescription drug abuse is the use of a prescription medication in a way not intended by the prescribing doctor. Prescription drug abuse or problematic use includes everything from taking a friend's prescription painkiller for your backache to snorting or injecting ground-up pills to get high. Drug abuse may become ongoing and compulsive, despite the negative consequences.","['Opioids used to treat pain, for example medications containing oxycodone — such as Oxycontin and Percocet — and those containing hydrocodone — such as Norco', 'Anti-anxiety medications and sedatives, such as alprazolam (Xanax) and diazepam (Valium), and hypnotics, such as zolpidem (Ambien), used to treat anxiety and sleep disorders', 'Stimulants, such as methylphenidate (Ritalin, Concerta, others), dextroamphetamine and amphetamine (Adderall XR, Mydayis), and dextroamphetamine (Dexedrine), used to treat attention-deficit/hyperactivity disorder (ADHD) and certain sleep disorders']",[]
150,"Pressure sore, also known as
Bedsores (pressure ulcers)",https://www.mayoclinic.org/diseases-conditions/bed-sores/symptoms-causes/syc-20355893,"Bedsores — also called pressure ulcers and decubitus ulcers — are injuries to skin and underlying tissue resulting from prolonged pressure on the skin. Bedsores most often develop on skin that covers bony areas of the body, such as the heels, ankles, hips and tailbone.","['Unusual changes in skin color or texture', 'Swelling', 'Pus-like draining', 'An area of skin that feels cooler or warmer to the touch than other areas', 'Tender areas']",[]
151,"Pressure ulcer, also known as
Bedsores (pressure ulcers)",https://www.mayoclinic.org/diseases-conditions/bed-sores/symptoms-causes/syc-20355893,"Bedsores — also called pressure ulcers and decubitus ulcers — are injuries to skin and underlying tissue resulting from prolonged pressure on the skin. Bedsores most often develop on skin that covers bony areas of the body, such as the heels, ankles, hips and tailbone.","['Unusual changes in skin color or texture', 'Swelling', 'Pus-like draining', 'An area of skin that feels cooler or warmer to the touch than other areas', 'Tender areas']",[]
152,Preterm labor,https://www.mayoclinic.org/diseases-conditions/preterm-labor/symptoms-causes/syc-20376842,Preterm labor occurs when regular contractions result in the opening of your cervix after week 20 and before week 37 of pregnancy.,"['Regular or frequent sensations of abdominal tightening (contractions)', 'Constant low, dull backache', 'A sensation of pelvic or lower abdominal pressure', 'Mild abdominal cramps', 'Vaginal spotting or light bleeding', 'Preterm rupture of membranes — in a gush or a continuous trickle of fluid after the membrane around the baby breaks or tears', 'A change in type of vaginal discharge — watery, mucus-like or bloody']","[""Ask about pre-appointment restrictions. In most cases you'll be seen immediately. If that's not the case, ask whether you should restrict your activity while you wait for your appointment."", 'Ask a loved one or friend to join you for your appointment. The fear you might be feeling about the possibility of preterm labor can make it difficult to focus on what your health care provider says. Take someone along who can help remember all the information.', ""Write down questions to ask your health care provider. That way, you won't forget anything important that you want to ask, and you can make the most of your time with your health care provider.""]"
153,Priapism,https://www.mayoclinic.org/diseases-conditions/priapism/symptoms-causes/syc-20352005,Priapism is a prolonged erection of the penis. The full or partial erection continues hours beyond or isn't caused by sexual stimulation. The main types of priapism are ischemic and nonischemic. Ischemic priapism is a medical emergency.,"['Erection lasting more than four hours or unrelated to sexual interest or stimulation', 'Rigid penile shaft, but the tip of penis (glans) is soft', 'Progressively worsening penile pain']",[]
