,disease,link,overview,symptoms,remedies
0,Paraganglioma,https://www.mayoclinic.org/diseases-conditions/paraganglioma/cdc-20352970,,[],[]
1,"Paraneoplastic neurological disorder, also known as
Paraneoplastic syndromes of the nervous system",https://www.mayoclinic.org/diseases-conditions/paraneoplastic-syndromes/symptoms-causes/syc-20355687,"Paraneoplastic syndromes of the nervous system are a group of uncommon disorders that develop in some people who have cancer. Paraneoplastic syndromes can also affect other organ systems including hormones (endocrine), skin (dermatologic), blood (hematologic) and joints (rheumatologic).","['Difficulty walking', 'Difficulty maintaining balance', 'Loss of muscle coordination', 'Loss of muscle tone or weakness', 'Loss of fine motor skills, such as picking up objects', 'Difficulty swallowing', 'Slurred speech or stuttering', 'Memory loss and other thinking (cognitive) impairment', 'Vision problems', 'Sleep disturbances', 'Seizures', 'Hallucinations', 'Unusual involuntary movements']",[]
2,"Paraneoplastic neurological syndrome, also known as
Paraneoplastic syndromes of the nervous system",https://www.mayoclinic.org/diseases-conditions/paraneoplastic-syndromes/symptoms-causes/syc-20355687,"Paraneoplastic syndromes of the nervous system are a group of uncommon disorders that develop in some people who have cancer. Paraneoplastic syndromes can also affect other organ systems including hormones (endocrine), skin (dermatologic), blood (hematologic) and joints (rheumatologic).","['Difficulty walking', 'Difficulty maintaining balance', 'Loss of muscle coordination', 'Loss of muscle tone or weakness', 'Loss of fine motor skills, such as picking up objects', 'Difficulty swallowing', 'Slurred speech or stuttering', 'Memory loss and other thinking (cognitive) impairment', 'Vision problems', 'Sleep disturbances', 'Seizures', 'Hallucinations', 'Unusual involuntary movements']",[]
3,Paraneoplastic syndromes of the nervous system,https://www.mayoclinic.org/diseases-conditions/paraneoplastic-syndromes/symptoms-causes/syc-20355687,"Paraneoplastic syndromes of the nervous system are a group of uncommon disorders that develop in some people who have cancer. Paraneoplastic syndromes can also affect other organ systems including hormones (endocrine), skin (dermatologic), blood (hematologic) and joints (rheumatologic).","['Difficulty walking', 'Difficulty maintaining balance', 'Loss of muscle coordination', 'Loss of muscle tone or weakness', 'Loss of fine motor skills, such as picking up objects', 'Difficulty swallowing', 'Slurred speech or stuttering', 'Memory loss and other thinking (cognitive) impairment', 'Vision problems', 'Sleep disturbances', 'Seizures', 'Hallucinations', 'Unusual involuntary movements']",[]
4,Parkinson's disease,https://www.mayoclinic.org/diseases-conditions/parkinsons-disease/symptoms-causes/syc-20376055,"Parkinson's disease is a progressive disorder that affects the nervous system and the parts of the body controlled by the nerves. Symptoms start slowly. The first symptom may be a barely noticeable tremor in just one hand. Tremors are common, but the disorder may also cause stiffness or slowing of movement.","[""Tremor. A tremor, or rhythmic shaking, usually begins in a limb, often your hand or fingers. You may rub your thumb and forefinger back and forth. This is known as a pill-rolling tremor. Your hand may tremble when it's at rest. The shaking may decrease when you are performing tasks."", ""Slowed movement (bradykinesia). Over time, Parkinson's disease may slow your movement, making simple tasks difficult and time-consuming. Your steps may become shorter when you walk. It may be difficult to get out of a chair. You may drag or shuffle your feet as you try to walk."", 'Rigid muscles. Muscle stiffness may occur in any part of your body. The stiff muscles can be painful and limit your range of motion.', ""Impaired posture and balance. Your posture may become stooped. Or you may fall or have balance problems as a result of Parkinson's disease."", 'Loss of automatic movements. You may have a decreased ability to perform unconscious movements, including blinking, smiling or swinging your arms when you walk.', 'Speech changes. You may speak softly, quickly, slur or hesitate before talking. Your speech may be more of a monotone rather than have the usual speech patterns.', 'Writing changes. It may become hard to write, and your writing may appear small.']","['Try not to move too quickly.', ""Aim for your heel to strike the floor first when you're walking."", ""If you notice yourself shuffling, stop and check your posture. It's best to stand up straight."", 'Look in front of you, not directly down, while walking.']"
5,Parotid tumors,https://www.mayoclinic.org/diseases-conditions/parotid-tumor/cdc-20388269,,[],"['Brush your teeth several times each day. Use a soft-bristled toothbrush and gently brush your teeth several times each day. Tell your doctor if your mouth becomes too sensitive to tolerate gentle brushing.', 'Rinse your mouth with warm salt water after meals. Make a mild solution of warm water and salt. Rinse your mouth with this solution after each meal.', 'Keep your mouth moistened with water or sugarless candies. Drink water throughout the day to keep your mouth moistened. Also try sugarless gum or sugarless candies to stimulate your mouth to produce saliva.', 'Choose moist foods. Avoid dry foods. Moisten dry food with sauce, gravy, broth, butter or milk.', ""Avoid acidic or spicy foods and drinks. Choose foods and drinks that won't irritate your mouth. Avoid caffeinated and alcoholic beverages.""]"
6,"Partial anomalous pulmonary venous connection, also known as
Partial anomalous pulmonary venous return",https://www.mayoclinic.org/diseases-conditions/partial-anomalous-pulmonary-venous-return/cdc-20385691,,[],[]
7,Partial anomalous pulmonary venous return,https://www.mayoclinic.org/diseases-conditions/partial-anomalous-pulmonary-venous-return/cdc-20385691,,[],[]
8,Parvovirus infection,https://www.mayoclinic.org/diseases-conditions/parvovirus-infection/symptoms-causes/syc-20376085,"Parvovirus infection is a common and highly contagious childhood illness. It's sometimes called slapped-cheek disease because of the distinctive face rash that develops. Parvovirus infection has also been known as fifth disease because, historically, it was fifth in a list of common childhood illnesses characterized by a rash.","['Fever', 'Upset stomach', 'Headache', 'Runny nose']","['When and how you or your child was exposed to parvovirus', 'A detailed description of symptoms', 'Medical problems that run in your family', 'Medical problems you or your child has had in the past', 'All the drugs and supplements you or your child takes']"
9,Patellar tendinitis,https://www.mayoclinic.org/diseases-conditions/patellar-tendinitis/symptoms-causes/syc-20376113,"Patellar tendinitis is an injury to the tendon connecting your kneecap (patella) to your shinbone. The patellar tendon works with the muscles at the front of your thigh to extend your knee so that you can kick, run and jump.","['Continues or worsens', 'Interferes with your ability to perform routine daily activities', 'Is associated with swelling or redness about the joint']","['Pain relievers. Over-the-counter medications such as ibuprofen and naproxen sodium may provide short-term pain relief.', 'Avoid activity that causes pain. You may need to practice your sport less often or temporarily switch to a lower impact sport. Working through pain can further damage your patellar tendon.', 'Ice. Apply ice after activity that causes pain. Place ice in a plastic bag and wrap the bag in a towel. Or try an ice massage. Freeze water in a plastic foam cup and hold the cup as you apply the ice directly to your skin.']"
10,Patellofemoral pain syndrome,https://www.mayoclinic.org/diseases-conditions/patellofemoral-pain-syndrome/symptoms-causes/syc-20350792,"Patellofemoral (puh-tel-o-FEM-uh-rul) pain syndrome is pain at the front of your knee, around your kneecap (patella). Sometimes called ""runner's knee,"" it's more common in people who participate in sports that involve running and jumping.","['Walk up or down stairs', 'Kneel or squat', 'Sit with a bent knee for long periods of time']",[]
11,Patent ductus arteriosus (PDA),https://www.mayoclinic.org/diseases-conditions/patent-ductus-arteriosus/symptoms-causes/syc-20376145,"Patent ductus arteriosus (PDA) is a persistent opening between the two major blood vessels leading from the heart. The opening (ductus arteriosus) is a normal part of a baby's circulatory system in the womb that usually closes shortly after birth. If it remains open, it's called a patent ductus arteriosus.","['Poor eating, which leads to poor growth', 'Sweating with crying or eating', 'Persistent fast breathing or breathlessness', 'Easy tiring', 'Rapid heart rate']","['Preventing infection. For most people who have a patent ductus arteriosus, regularly brushing and flossing teeth and regular dental checkups are the best ways to help prevent infection.', ""Exercising and play. People and parents of children who have congenital heart defects often worry about the risks of vigorous activity and rough play, even after successful treatment. Although some children and adults might need to limit the amount or type of exercise, most people who have patent ductus arteriosus will lead normal lives. Your or your child's doctor can advise you about which activities are safe.""]"
12,Patent foramen ovale,https://www.mayoclinic.org/diseases-conditions/patent-foramen-ovale/symptoms-causes/syc-20353487,A patent foramen ovale (PFO) is a hole in the heart that didn't close the way it should after birth. The small flaplike opening is between the right and left upper chambers of the heart (atria).,"['The right upper chamber (right atrium). The right atrium receives oxygen-poor blood from your body and pumps it into the right ventricle through the tricuspid valve.', 'The right lower chamber (right ventricle). The right ventricle pumps the blood through a large vessel called the pulmonary artery and into the lungs, where the blood is resupplied with oxygen and carbon dioxide is removed from the blood. The blood is pumped through the pulmonary valve, which closes when the right ventricle relaxes between beats.', 'The left upper chamber (left atrium). The left atrium receives the oxygen-rich blood from the lungs through the pulmonary veins and pumps it into the left ventricle through the mitral valve.', ""The left lower chamber (left ventricle). The left ventricle pumps the oxygen-rich blood through the body's largest blood vessel (aorta) and on to the rest of the body. The blood passes through the aortic valve, which also closes when the left ventricle relaxes.""]","['What caused this to happen?', 'How dangerous is this condition?', 'What treatments are available, and which do you recommend?', 'What are the risks of a procedure to close the patent foramen ovale?', 'I have other health conditions. How can I best manage these conditions together?', 'Should activity be restricted in any way?', 'Could I have passed this condition on to my child?', 'Are there any brochures or other printed material that I can take home with me? What websites do you recommend visiting?']"
13,"Pathological gambling, also known as
Compulsive gambling",https://www.mayoclinic.org/diseases-conditions/compulsive-gambling/symptoms-causes/syc-20355178,"Compulsive gambling, also called gambling disorder, is the uncontrollable urge to keep gambling despite the toll it takes on your life. Gambling means that you're willing to risk something you value in the hope of getting something of even greater value.","['Being preoccupied with gambling, such as constantly planning gambling activities and how to get more gambling money', 'Needing to gamble with increasing amounts of money to get the same thrill', 'Trying to control, cut back or stop gambling, without success', 'Feeling restless or irritable when you try to cut down on gambling', 'Gambling to escape problems or relieve feelings of helplessness, guilt, anxiety or depression', 'Trying to get back lost money by gambling more (chasing losses)', 'Lying to family members or others to hide the extent of your gambling', 'Risking or losing important relationships, a job, or school or work opportunities because of gambling', 'Asking others to bail you out of financial trouble because you gambled money away']",[]
14,"Pathological laughter and crying, also known as
Pseudobulbar affect",https://www.mayoclinic.org/diseases-conditions/pseudobulbar-affect/symptoms-causes/syc-20353737,"Pseudobulbar affect (PBA) is a condition that's characterized by episodes of sudden uncontrollable and inappropriate laughing or crying. Pseudobulbar affect typically occurs in people with certain neurological conditions or injuries, which might affect the way the brain controls emotion.","['Stroke', 'Amyotrophic lateral sclerosis (ALS)', 'Multiple sclerosis (MS)', 'Traumatic brain injury', ""Alzheimer's disease"", ""Parkinson's disease""]",[]
15,"Pathological stealing, also known as
Kleptomania",https://www.mayoclinic.org/diseases-conditions/kleptomania/symptoms-causes/syc-20364732,Kleptomania (klep-toe-MAY-nee-uh) is the recurrent inability to resist urges to steal items that you generally don't really need and that usually have little value. Kleptomania is a rare but serious mental health disorder that can cause much emotional pain to you and your loved ones if not treated.,"[""Inability to resist powerful urges to steal items that you don't need"", 'Feeling increased tension, anxiety or arousal leading up to the theft', 'Feeling pleasure, relief or gratification while stealing', 'Feeling terrible guilt, remorse, self-loathing, shame or fear of arrest after the theft', 'Return of the urges and a repetition of the kleptomania cycle']",[]
16,"PBA, also known as
Pseudobulbar affect",https://www.mayoclinic.org/diseases-conditions/pseudobulbar-affect/symptoms-causes/syc-20353737,"Pseudobulbar affect (PBA) is a condition that's characterized by episodes of sudden uncontrollable and inappropriate laughing or crying. Pseudobulbar affect typically occurs in people with certain neurological conditions or injuries, which might affect the way the brain controls emotion.","['Stroke', 'Amyotrophic lateral sclerosis (ALS)', 'Multiple sclerosis (MS)', 'Traumatic brain injury', ""Alzheimer's disease"", ""Parkinson's disease""]",[]
17,"PCOS, also known as
Polycystic ovary syndrome (PCOS)",https://www.mayoclinic.org/diseases-conditions/pcos/symptoms-causes/syc-20353439,"Polycystic ovary syndrome (PCOS) is a problem with hormones that happens during the reproductive years. If you have PCOS, you may not have periods very often. Or you may have periods that last many days. You may also have too much of a hormone called androgen in your body.","[""Irregular periods. Having few menstrual periods or having periods that aren't regular are common signs of PCOS. So is having periods that last for many days or longer than is typical for a period. For example, you might have fewer than nine periods a year. And those periods may occur more than 35 days apart. You may have trouble getting pregnant."", 'Too much androgen. High levels of the hormone androgen may result in excess facial and body hair. This is called hirsutism. Sometimes, severe acne and male-pattern baldness can happen, too.', 'Polycystic ovaries. Your ovaries might be bigger. Many follicles containing immature eggs may develop around the edge of the ovary. The ovaries might not work the way they should.']","['Stay at a healthy weight. Weight loss can lower insulin and androgen levels. It also may restore ovulation. Ask your health care provider about a weight-control program, if you need one. Meet with a registered dietitian for help in reaching weight-loss goals.', 'Limit carbohydrates. High-carbohydrate diets might make insulin levels go higher. Ask your provider if a low-carbohydrate diet could help if you have PCOS. Choose complex carbohydrates, which raise your blood sugar levels more slowly. Complex carbohydrates are found in fruits, vegetables, whole grains and cooked dry beans and peas.', 'Be active. Exercise helps lower blood sugar levels. If you have PCOS, increasing your daily activity and getting regular exercise may treat or even prevent insulin resistance. Being active may also help you keep your weight under control and avoid developing diabetes.']"
18,"PDA, also known as
Patent ductus arteriosus (PDA)",https://www.mayoclinic.org/diseases-conditions/patent-ductus-arteriosus/symptoms-causes/syc-20376145,"Patent ductus arteriosus (PDA) is a persistent opening between the two major blood vessels leading from the heart. The opening (ductus arteriosus) is a normal part of a baby's circulatory system in the womb that usually closes shortly after birth. If it remains open, it's called a patent ductus arteriosus.","['Poor eating, which leads to poor growth', 'Sweating with crying or eating', 'Persistent fast breathing or breathlessness', 'Easy tiring', 'Rapid heart rate']","['Preventing infection. For most people who have a patent ductus arteriosus, regularly brushing and flossing teeth and regular dental checkups are the best ways to help prevent infection.', ""Exercising and play. People and parents of children who have congenital heart defects often worry about the risks of vigorous activity and rough play, even after successful treatment. Although some children and adults might need to limit the amount or type of exercise, most people who have patent ductus arteriosus will lead normal lives. Your or your child's doctor can advise you about which activities are safe.""]"
19,Peanut allergy,https://www.mayoclinic.org/diseases-conditions/peanut-allergy/symptoms-causes/syc-20376175,"Peanut allergy is one of the most common causes of severe allergy attacks. For some people with peanut allergy, even tiny amounts of peanuts can cause a serious reaction that can even be life-threatening (anaphylaxis).","['Skin reactions, such as hives, redness or swelling', 'Itching or tingling in or around the mouth and throat', 'Digestive problems, such as diarrhea, stomach cramps, nausea or vomiting', 'Tightening of the throat', 'Shortness of breath or wheezing', 'Runny nose']","[""Never assume that a food doesn't contain peanuts. Peanuts may be in foods that you had no idea contained them. Always read labels on manufactured foods to make sure they don't contain peanuts or peanut products. Manufactured foods are required to clearly state whether foods contain any peanuts and if they were produced in factories that also process peanuts.\nEven if you think you know what's in a food, check the label. Ingredients may change."", ""Don't ignore a label that says a food was produced in a factory that processes peanuts. Most people with a peanut allergy need to avoid all products that could contain even trace amounts of peanuts."", 'When in doubt, say ""no thanks."" At restaurants and social gatherings, you\'re always taking a risk that you might accidentally eat peanuts. Many people don\'t understand the seriousness of an allergic food reaction, and may not realize that a tiny amount of a food can cause a severe reaction. If you are at all worried that a food may contain something you\'re allergic to, don\'t try it.', 'Be prepared for a reaction. Talk with your doctor about carrying emergency medications in case of a severe reaction.']"
20,Pectus excavatum,https://www.mayoclinic.org/diseases-conditions/pectus-excavatum/symptoms-causes/syc-20355483,"Pectus excavatum is a condition in which the person's breastbone is sunken into the chest. In severe cases, pectus excavatum can look as if the center of the chest has been scooped out, leaving a deep dent.","['Decreased exercise tolerance', 'Rapid heartbeat or heart palpitations', 'Recurrent respiratory infections', 'Wheezing or coughing', 'Chest pain', 'Heart murmur', 'Fatigue', 'Dizziness']",[]
21,Pediatric brain tumors,https://www.mayoclinic.org/diseases-conditions/pediatric-brain-tumor/symptoms-causes/syc-20361694,Pediatric brain tumors are masses or growths of abnormal cells that occur in a child's brain or the tissue and structures that are near it. Many different types of pediatric brain tumors exist — some are noncancerous (benign) and some are cancerous (malignant).,"['Headaches, which may become more frequent and more severe', 'Feeling of increased pressure in the head', 'Unexplained nausea or vomiting', 'Abrupt onset of vision problems, such double vision']",[]
22,Pediatric obstructive sleep apnea,https://www.mayoclinic.org/diseases-conditions/pediatric-sleep-apnea/symptoms-causes/syc-20376196,Pediatric obstructive sleep apnea is a sleep disorder in which your child's breathing is partially or completely blocked repeatedly during sleep. The condition is due to narrowing or blockage of the upper airway during sleep.,"['Snoring', 'Pauses in breathing', 'Restless sleep', 'Snorting, coughing or choking', 'Mouth breathing', 'Nighttime sweating', 'Bed-wetting', 'Sleep terrors']","['Avoid airway irritants and allergens. All children, but especially those with pediatric obstructive sleep apnea, should be kept away from exposure to tobacco smoke or other indoor allergens or pollutants, as they can cause airway irritation and congestion.', 'Weight loss. Doctors may recommend that your child lose weight if he or she is obese. Your doctor can provide you and your child with diet and nutrition information, or refer your child to other specialists with expertise in managing obesity.']"
23,Pediatric white blood cell disorders,https://www.mayoclinic.org/diseases-conditions/pediatric-white-blood-cell-disorders/symptoms-causes/syc-20352674,"Your body produces white blood cells (leukocytes), which help fight bacterial infections, viruses and fungi. If your child has too few or too many white blood cells, in general, here's what it means:",[],[]
24,"Pediculosis capitis, also known as
Head lice",https://www.mayoclinic.org/diseases-conditions/head-lice/symptoms-causes/syc-20356180,Head lice are tiny insects that feed on blood from the human scalp. Head lice most often affect children. The insects usually spread through direct transfer from the hair of one person to the hair of another.,"['Itching. The most common symptom of head lice is itching on the scalp, neck and ears. This is an allergic reaction to louse bites. When a person has head lice for the first time, itching may not occur for 4 to 6 weeks.', ""Lice on scalp. You may be able to see the lice, but they're often hard to spot because they're small, avoid light and move quickly."", ""Lice eggs (nits) on hair shafts. Nits stick to hair shafts and may be hard to see because they're very tiny. They're easiest to spot around the ears and the hairline of the neck. Empty nits may be easier to spot because they're lighter in color and further from the scalp. However, the presence of nits doesn't mean there are live lice."", 'Sores on the scalp, neck and shoulders. Scratching can lead to small, red bumps that may sometimes get infected with bacteria.']","['Tea tree oil', 'Anise oil', 'Ylang-ylang oil']"
25,Pelvic inflammatory disease (PID),https://www.mayoclinic.org/diseases-conditions/pelvic-inflammatory-disease/symptoms-causes/syc-20352594,"Pelvic inflammatory disease (PID) is an infection of the female reproductive organs. It most often occurs when sexually transmitted bacteria spread from your vagina to your uterus, fallopian tubes or ovaries.","['Pain — ranging from mild to severe — in your lower abdomen and pelvis', 'Unusual or heavy vaginal discharge that may have an unpleasant odor', 'Unusual bleeding from the vagina, especially during or after sex, or between periods', 'Pain during sex', 'Fever, sometimes with chills', 'Painful, frequent or difficult urination']",[]
26,Pelvic organ prolapse,https://www.mayoclinic.org/diseases-conditions/pelvic-organ-prolapse/symptoms-causes/syc-20360557,"When the muscles and ligaments supporting a woman's pelvic organs weaken, the pelvic organs can drop lower in the pelvis, creating a bulge in the vagina (prolapse). Women most commonly develop pelvic organ prolapse years after childbirth, after a hysterectomy or after menopause. If you have symptoms, such as a feeling of pressure in your pelvic area, see your health care provider.",[],[]
27,"Pelvic pain, chronic, also known as
Chronic pelvic pain in women",https://www.mayoclinic.org/diseases-conditions/chronic-pelvic-pain/symptoms-causes/syc-20354368,Chronic pelvic pain is pain in the area below your bellybutton and between your hips that lasts six months or longer.,"['Severe and steady pain', 'Pain that comes and goes (intermittent)', 'Dull aching', 'Sharp pains or cramping', 'Pressure or heaviness deep within your pelvis']","[""Make a list of any signs and symptoms you're experiencing. Include any that may seem unrelated to the reason for your appointment."", 'Make a note of key medical information. Include any major stresses or recent life changes.', ""Make a list of all medications and the doses. Include any prescription and nonprescription drugs, vitamins or other supplements you're taking."", 'Consider taking a family member or friend along. Sometimes it can be difficult to remember all the information provided during an appointment. Someone who goes with you may remember something that you missed or forgot.', 'Prepare questions. Your time with your doctor is limited, so preparing a list of questions can help you make the most of your time together.']"
